{"schema_version":1,"spec_ref":"specs/AR-1600.json","spec_revision":1,"acceptance_predicates":[{"id":"quota","description":"Development source and artifact staging remain within explicit aggregate quotas."},{"id":"cleanup","description":"Timeout, quota, scan, and staging failures terminate and reap the process group and remove temporary roots."},{"id":"private","description":"Published executable and artifact trees use private permissions and reject unsafe entries."},{"id":"atomic","description":"Successful and replacement activation publish a complete executable/provenance pair or restore the prior pair."},{"id":"nonblocking","description":"Development runs do not block on missing authentication, signatures, or key management."}],"definition_of_done":["Bounded staging implementation is merged on protected ASB main.","Independent review, hosted checks, and exact-main post-merge workflows pass."],"inputs":[{"id":"materializer","description":"Development TUI materialization path."},{"id":"provenance","description":"Released development install provenance contract."}],"outputs":[{"id":"bounded-staging","description":"Quota-bound, private, cleanup-safe development artifact staging."}],"allowed_tools":["cargo","git","gh","python","tools/handoffctl"],"forbidden_tools":["unbounded-child-processes","shared-artifact-permissions","production-auth-bypass"],"required_evidence_classes":["contract-test","mechanical","environmental"],"gates":[{"id":"local","description":"Focused tests, fmt, clippy, and diff checks pass."},{"id":"hosted","description":"Independent review, hosted checks, and post-merge workflows are green."}]}
