{"schema_version":1,"spec_ref":"specs/AR-1594.json","spec_revision":1,"acceptance_predicates":[{"id":"feature-isolation","description":"The external pinned asb-tui qualification test is compiled only with the explicit cross-repo-qualification feature, while the dedicated workflow enables that feature and runs the real binary journey."},{"id":"coverage-preserved","description":"The existing workspace coverage threshold remains unchanged and the feature-gated repair passes the required hosted policy gate."},{"id":"signed-review","description":"The exact PR #412 repair head is signed, DCO-certified, independently reviewed, and all required hosted checks pass before merge."}],"definition_of_done":["The feature-gated qualification repair is merged on protected ASB main.","The exact TUI qualification workflow remains enabled and passes.","No coverage threshold or exclusion policy is weakened."],"inputs":[{"id":"pr412","description":"ASB PR #412 exact repair head and hosted check receipt."}],"outputs":[{"id":"coverage-isolation","description":"Explicit feature-gated cross-repository qualification seam preserving ordinary workspace coverage."}],"allowed_tools":["cargo","git","gh","tools/handoffctl"],"forbidden_tools":[],"required_evidence_classes":["contract-test","mechanical"],"gates":[{"id":"hosted","description":"All required hosted checks pass on the exact reviewed PR head."}]}
