{"schema_version":1,"spec_ref":"specs/AR-1643.json","spec_revision":1,"acceptance_predicates":[{"id":"journey","description":"A fresh user can run clone, setup, benchmark, record, replay, and compare from one runner."},{"id":"offline","description":"The subsequent run completes without provider egress."},{"id":"guidance","description":"Selections and human-readable progress minimize manual typing and documentation lookup."}],"definition_of_done":["Runner passes exact-head disposable acceptance for opencode/opendesk and OpenRouter development fixtures.","Independent review and hosted checks pass."],"inputs":[{"id":"task-record","description":"Existing task acceptance, evidence requirements, and development-only constraints."}],"outputs":[{"id":"qualified-record","description":"Strict-schema task specification and generated coordination projections."}],"allowed_tools":["git","gh","tools/handoffctl"],"forbidden_tools":["product-code","credential-output","gate-weakening"],"required_evidence_classes":["environmental","hosted"],"gates":[{"id":"acceptance","description":"All existing acceptance predicates and definition-of-done checks pass without weakening thresholds."}]}
