{"schema_version":1,"spec_ref":"specs/AR-1724.json","spec_revision":1,"acceptance_predicates":[{"id":"bounded-sweep","description":"The easy sweep runs selected or all configured agents and workloads with bounded progress and cleanup."},{"id":"default-online","description":"The configured live provider is the default source and local mock or replay require explicit selection."},{"id":"identity","description":"Every tuple preserves exact provider, model, agent, workload, and provenance identity."},{"id":"no-fallback","description":"Live, mock, and replay failures remain typed and never silently change mode."}],"definition_of_done":["Exact reviewed selected/all sweep is merged on current ASB main.","Independent review and exact-head hosted checks pass with a privacy-safe receipt."],"inputs":[{"id":"easy-run","description":"AR-1723 default-online run path."},{"id":"sweep-selection","description":"Selected/all agent and workload configuration."}],"outputs":[{"id":"sweep-receipt","description":"Bounded live, local, or replay sweep results with exact provenance."}],"allowed_tools":["cargo","git","gh","tools/handoffctl"],"forbidden_tools":["credential-output","silent-fallback","unbounded-run"],"required_evidence_classes":["contract-test","mechanical","environmental"],"gates":[{"id":"coverage","description":"Selected/all tuple coverage and cleanup pass."},{"id":"provenance","description":"Results preserve exact source mode and identity."}]}
