{"schema_version":1,"spec_ref":"specs/AR-1602.json","spec_revision":1,"acceptance_predicates":[{"id":"record","description":"The typed control contract starts a selected agent/workload recording and returns a campaign-bound cassette identity without raw provider material."},{"id":"seal","description":"Sealing publishes digest-only cassette metadata, exact coverage, provider-profile identity, and immutable provenance."},{"id":"replay","description":"The backend exposes an authority-checked replay dispatch that enforces exact cassette/provider/agent identity and denies provider egress."},{"id":"failures","description":"Missing, malformed, partial, stale, expired, duplicate, and agent-mismatch cassettes return deterministic typed errors."},{"id":"compatibility","description":"Existing CLI lifecycle and stable fail-closed boundaries remain compatible; development auth/signature/key absence is non-blocking."}],"definition_of_done":["The additive cassette control contract is merged on protected ASB main.","Real backend and provider-free replay evidence is independently reviewed and recorded."],"inputs":[{"id":"cassette-lifecycle","description":"Released ASB cassette recording/sealing/offline replay implementation."},{"id":"control","description":"Released ASB/TUI typed control and catalog contracts."}],"outputs":[{"id":"cassette-control","description":"Versioned record/seal/replay control seam consumed by asb-tui."}],"allowed_tools":["cargo","git","gh","python","tools/handoffctl"],"forbidden_tools":["raw-secret-projection","provider-egress-in-replay","synthetic-continuity"],"required_evidence_classes":["contract-test","mechanical","environmental"],"gates":[{"id":"schema","description":"Versioned schemas and compatibility fixtures pass."},{"id":"real-backend","description":"Real record/seal/replay dispatch and negative matrix pass."},{"id":"hosted","description":"Independent review, hosted checks, and post-merge verification are green."}]}
