{"schema_version":1,"spec_ref":"specs/AR-1716.json","spec_revision":1,"acceptance_predicates":[{"id":"provider-binding","description":"RecordingIndex::insert requires exact reviewed provider-profile identity, digest, and generation binding."},{"id":"fail-closed","description":"Missing, stale, or mismatched identity is rejected before index or cassette mutation."},{"id":"diagnostics","description":"Human and --json diagnostics identify the typed identity failure without secrets or response content."},{"id":"development-boundary","description":"Missing development authentication, signatures, and keys remain warnings and do not block local/mock setup."}],"definition_of_done":["Focused positive, mismatch, stale, missing, and no-mutation tests pass.","Full relevant tests, privacy, independent review, and hosted checks pass."],"inputs":[{"id":"reviewed-profile","description":"Provider profile identity, digest, and generation from the run plan."},{"id":"cassette-entry","description":"Recording entry identity and bounded metadata."}],"outputs":[{"id":"bound-index-entry","description":"Provider-bound recording index entry."},{"id":"typed-rejection","description":"Stable privacy-safe identity rejection."}],"allowed_tools":["git","gh","cargo","tools/handoffctl"],"forbidden_tools":["secret-output","partial-mutation","gate-weakening"],"required_evidence_classes":["contract-test","mechanical","hosted"],"gates":[{"id":"binding","description":"Provider identity and generation are enforced before mutation."},{"id":"diagnostics","description":"Human and JSON mismatch diagnostics remain stable and secret-free."}]}
