{"schema_version":1,"spec_ref":"specs/AR-1640.json","spec_revision":1,"acceptance_predicates":[{"id":"reproduce","description":"Private validated tools with cleared PATH reproduce the nested TUI build failure before the repair."},{"id":"bounded","description":"TUI linker-tool resolution uses validated absolute paths and never restores ambient PATH."},{"id":"propagation","description":"CC, AR, LD, Rust linker, and target linker flags reach the nested Cargo build explicitly."},{"id":"lifecycle","description":"Fresh ASB installation followed by nested TUI build succeeds under cleared development environment."},{"id":"stable","description":"Stable and production trust boundaries remain unchanged."},{"id":"development-boundary","description":"Missing development authentication, signatures, and key management remain warning-only."}],"definition_of_done":["Signed TUI repair is merged on protected main.","Independent review, hosted checks, and exact paired qualification are green."],"inputs":[{"id":"asb-linker-contract","description":"ASB AR-1639 merged auxiliary-linker contract."},{"id":"tui-materializer","description":"Standalone TUI development materializer and tool validation."}],"outputs":[{"id":"tui-linker-contract","description":"Bounded nested-build linker propagation and qualification evidence."}],"allowed_tools":["cargo","git","gh","tools/handoffctl"],"forbidden_tools":["ambient-path-widening","production-auth-bypass","coverage-threshold-lowering"],"required_evidence_classes":["contract-test","mechanical","environmental","hosted"],"gates":[{"id":"focused","description":"Focused TUI toolchain propagation tests pass."},{"id":"hosted","description":"Required TUI hosted checks pass on exact reviewed head."},{"id":"paired","description":"Exact ASB/TUI nested-build and lifecycle qualification succeeds."}]}
