{"schema_version":1,"spec_ref":"specs/AR-1909.json","spec_revision":1,"acceptance_predicates":[{"id":"authorized-bootstrap","description":"Use only handoffctl-authorized worktree bootstrap."},{"id":"retention-test","description":"Execute AR-1906 bounded retention test or record blocker."}],"definition_of_done":["Bootstrap path and bounded test result are durable."],"inputs":[{"id":"ar1906","description":"AR-1906 immutable bindings."}],"outputs":[{"id":"bootstrap","description":"Authorized bootstrap result."}],"allowed_tools":["tools/handoffctl"],"forbidden_tools":["direct-git-worktree","formal-success-without-evidence"],"required_evidence_classes":["mechanical"],"gates":[{"id":"scope","description":"No path widening or history mutation."}]}
