{"schema_version":1,"spec_ref":"specs/AR-1552.json","spec_revision":1,"acceptance_predicates":[{"id":"dynamic","description":"Plan creation enumerates the canonical supported workload catalog rather than a duplicated fixed list."},{"id":"valid","description":"Every emitted plan validates through the existing ASB planner."}],"definition_of_done":["Workload selection and plan materialization are reusable and tested.","New catalog entries are selectable without CLI source edits.","Credentials and runtime authority remain outside generated plans."],"inputs":[{"id":"catalog","description":"Canonical ASB workload and measurement catalogs."}],"outputs":[{"id":"plan","description":"Schema-valid content-addressed experiment plan."}],"allowed_tools":["cargo","git","python"],"forbidden_tools":[],"required_evidence_classes":["contract-test"],"gates":[{"id":"focused","description":"Focused plan-generation tests pass."},{"id":"workspace","description":"Relevant locked workspace tests pass."}]}
