{"schema_version":1,"spec_ref":"specs/AR-1898.json","spec_revision":1,"acceptance_predicates":[{"id":"scope","description":"Envelope admits exactly tools/change_drift.py and focused tests."},{"id":"result","description":"Focused replacement test records pass or fail-closed result."}],"definition_of_done":["Exact scope bound and bounded execution attempted."],"inputs":[{"id":"ar1896","description":"Missing change_drift import evidence."}],"outputs":[{"id":"receipt","description":"Focused execution evidence."}],"allowed_tools":["python","tools/handoffctl"],"forbidden_tools":["force-clear","cross-root","network","tlc"],"required_evidence_classes":["contract-test","mechanical"],"gates":[{"id":"focused","description":"Focused test or exact blocker."}]}
