{"schema_version":1,"spec_ref":"specs/AR-1572.json","spec_revision":1,"acceptance_predicates":[{"id":"runner","description":"Development setup stages and dispatches cargo, git, and setsid only from a private trusted toolchain."},{"id":"boundary","description":"Toolchain roots, ancestors, Cargo home, source overrides, and command paths are bounded and unsafe inputs fail closed."},{"id":"rollback","description":"Failed replacement preserves the prior usable toolchain."},{"id":"stable","description":"Stable installation behavior remains unchanged and development mode does not require production credentials."},{"id":"checks","description":"Exact hosted checks pass on merged PR #404."}],"definition_of_done":["PR #404 is merged on protected main.","Independent review and all required hosted checks are green."],"inputs":[{"id":"resolver","description":"Merged trusted development resolver from AR-1567."}],"outputs":[{"id":"runner","description":"Private reproducible development toolchain runner."}],"allowed_tools":["cargo","git","gh","tools/handoffctl"],"forbidden_tools":[],"required_evidence_classes":["contract-test","mechanical"],"gates":[{"id":"hosted","description":"All required hosted checks pass."}]}
