{"schema_version":1,"spec_ref":"specs/AR-1700.json","spec_revision":1,"acceptance_predicates":[{"id":"real-openrouter","description":"An explicit development-live run sends ChatCompletions requests to the selected OpenRouter provider/model for selected agents rather than using a mock or cassette."},{"id":"fanout-progress","description":"Selected/all OpenCode and OpenDesk execution reports bounded progress, provider/model identity, and typed per-run failures."},{"id":"operator-boundary","description":"Missing API credentials or transport failures are actionable live-run errors while setup, signatures, and production key management remain warning-only."},{"id":"offline-alternative","description":"Local/mock remains an explicit credential-free alternative and is never reported as live."}],"definition_of_done":["Exact merged ASB main contains development live run/sweep/fan-out wiring and focused live transport tests.","Hosted PR checks pass at the topology-repaired exact main head.","The evidence records that real provider reachability still requires an operator API key and that public release promotion is separate."],"inputs":[{"id":"live-selection","description":"Explicit live mode, selected agents, OpenRouter provider, and supported model."},{"id":"operator-key","description":"OPENROUTER_API_KEY supplied by the operator at live-run time."}],"outputs":[{"id":"benchmark-results","description":"Bounded human/JSON live benchmark outcomes including provider/model/request status without secrets."}],"allowed_tools":["cargo","git","gh","tools/handoffctl"],"forbidden_tools":["secret-output","silent-mock-fallback","unbounded-network-retry","production-release-claim"],"required_evidence_classes":["contract-test","hosted"],"gates":[{"id":"real-request","description":"Live mode reaches the selected OpenRouter endpoint or returns a typed transport/authentication failure."},{"id":"truthful-result","description":"No live result is claimed when no provider request was made."}]}
